key,title,year,month,day,journal,issn,volume,issue,pages,authors,url,language,publisher,location,abstract,notes,doi,keywords,pubmed_id,pmc_id
rayyan-1227306728,"Effect of methyl parathion and chlorpyrifos on certain biomarkers in various tissues of guppy fish, <i>Poecilia reticulata</i>",2011,10,NA,PESTICIDE BIOCHEMISTRY AND PHYSIOLOGY,"[""0048-3575"", ""1095-9939     J9  - PESTIC BIOCHEM PHYS     JI  - Pest. Biochem. Physiol.""]",101,2,132-141,"Sharbidre, AA and Metkari, V and Patode, P",,English,,"Univ Pune, Dept Zool, Pune 411007, Maharashtra, India","Tests of acute toxicity were performed on the most common species of aquarium fish, Poecilia reticulata. Guppies (P. reticulata) were exposed to progressive concentrations of methyl parathion (MP) and chlorpyrifos (CPF); a semi-static method according to guidelines of OECD was used. Tests of acute toxicity were conducted using 10 fish for each separate concentration and for the control group. The results were subjected to probit analysis to determine the 96 h LC50 values. The 96 h LC50 values of MP and CPF to P. reticulata were 8.48 ppm/L (5.98-10.89) and 0.176 ppm/L (0.313-0.224) respectively. In addition, behavioral changes at each concentration were observed for the individual fish. Fish were exposed for 96 h to different sublethal concentrations of MP and CPF (1/4 LC50, 1/8 LC50 and 1/10 LC50) and their oxidative stress-induction potential was estimated in brain, liver and gills of fish. MDA content is induced in all tissues but maximum rise was observed in gills (161% and 153% for MP and CPF respectively). With regard to antioxidant defense system (ADS). GSH level decreased in the brain, liver and gills of tissues of MP treated fishes (22%, 6% and 13% respectively) and showed increase in brain and gills CPF treated (23% and 21% respectively). CAT, GST, GR and SOD levels fluctuated in all treatment groups relative to the control. Brain AChE showed dose-dependent inhibition in fish exposed to the higher concentrations reached 45% and 66% for MP and CPF respectively. Collective findings demonstrated that pesticide exposure of fish induced an increase in MDA and fluctuated ADS along with inhibited AChE. These findings may be used as valuable biomarkers for evaluation of water pollution. (C) 2011 Elsevier Inc. All rights reserved.","Times Cited in Web of Science Core Collection:  97     Total Times Cited:  110     Cited Reference Count:  121 | RAYYAN-INCLUSION: {""Shiho""=>""Excluded"", ""Kyle ""=>""Maybe""} | RAYYAN-LABELS: no behaviour,unsure if measures behaviour",10.1016/j.pestbp.2011.09.002     WE  - Science Citation Index Expanded (SCI-EXPANDED),Antioxidant defense system;Lipid peroxidation;Acetylcholinesterase;FRESH-WATER FISH;INDUCED OXIDATIVE STRESS;CHANNA-PUNCTATUS BLOCH;CARP CYPRINUS-CARPIO;ANTIOXIDANT ENZYMES;LIPID-PEROXIDATION;REACTIVE OXYGEN;PROTECTIVE ROLE;ACUTE TOXICITY;DNA-DAMAGE;Biological Markers,NA,NA
rayyan-1227306729,ALARM SUBSTANCE RECOGNITION AND PREDATOR AVOIDANCE BY CHINOOK SALMON (<i>ONCORHYNCHUS TSCHAWYTSCHA</i>) FOLLOWING EXPOSURE TO AN ORGANOPHOSPHATE PESTICIDE,2010,5,NA,ENVIRONMENTAL TOXICOLOGY AND CHEMISTRY,"[""0730-7268"", ""1552-8618     J9  - ENVIRON TOXICOL CHEM     JI  - Environ. Toxicol. Chem.""]",29,5,1113-1122,"Palm, RC and Powell, DB",,English,,"ProFishent, Redmond, WA 98052 USA     FU  - Makhteshim Agan of North America     FX  - The authors acknowledge the use of the Battelle Marine Science Laboratory facilities and the wet laboratory assistance provided by Rhonda Karts. Funding was provided by Makhteshim Agan of North America. We also thank the Washington Department of Fish and Wildlife for the chinook salmon. Statistical consulting was provided by Alice Shelly of TerraStat Consulting Group (Seattle, WA).     PU  - WILEY     PI  - HOBOKEN     PA  - 111 RIVER ST, HOBOKEN 07030-5774, NJ USA","The sense of smell in fish is thought to be important for behaviors associated with alarm scent recognition and predator avoidance. Olfactory function of juvenile chinook salmon was evaluated in two separate experiments following 2-h immersion exposures to 0, 1, 10, or 100 mu g diazinon/L. In the first test system. groups of 10 salmon were transferred to the prechoice zone of a Y-maze fluviarium with parallel streams of water. A dilute alarm scent composed of either chinook skin extract or L-serine was pumped into the water supply of one arm. Fish were allowed to choose either upstream arm by raising a containment screen for 10 min, then their positions were photographed and the screen lowered. In the second test system the relationship of diazinon exposure to predation susceptibility was directly examined by transferring groups of 20 salmon (10 diazinon-exposed, 10 control) to troughs containing a protective cover. These salmon were given two olfactory warnings by delivering conspecific skin extract to both their transfer container and the predation tank they entered. After a 2-min prey acclimation period, larger predator rainbow trout were allowed access to the downstream section of the tank containing the test salmon. The combined fish were observed until approximately 50% of the prey fish had been consumed. Statistical comparisons indicated that although the salmon did avoid the water streams containing alarm scents. none of the diazinon exposure levels resulted in significantly different outcomes from the controls (alpha = 0.05) in either the two-choice maze study or the predation study. Possible environmental and population implications are discussed in light of related olfaction and diazinon studies. Environ. Toxicol. Chem. 2010:29:1113-1122. (C) 2010 SETAC","Times Cited in Web of Science Core Collection:  7     Total Times Cited:  8     Cited Reference Count:  39 | RAYYAN-INCLUSION: {""Shiho""=>""Excluded"", ""Kyle ""=>""Maybe""} | RAYYAN-LABELS: not adult fish,not sure on life stage",10.1002/etc.142     WE  - Science Citation Index Expanded (SCI-EXPANDED),Diazinon;Chinook salmon;Olfaction;Y-maze;Predation;DECISION-MAKING;COHO SALMON;FISH;DIAZINON;ANTIPREDATOR;BEHAVIOR;TROUT;RESPONSES;RISK;Pesticides;Prednisolone;Organophosphates,NA,NA
rayyan-1227306731,"Acute toxicity and histopathological alterations of Roundup® herbicide on ""cachama blanca"" (<i>Piaractus brachypomus</i>)",2008,11,NA,PESQUISA VETERINARIA BRASILEIRA,"[""0100-736X"", ""1678-5150     J9  - PESQUI VET BRASIL     JI  - Pesqui. Vet. Bras.""]",28,11,547-554,"Ramírez-Duarte, WF and Rondón-Barragán, IS and Eslava-Mocha, PR",,English,,"Univ Llanos, Inst Acuicultura, Villavicencio, Meta, Colombia     FU  - Instituto de Investigaciones de la Orinoquia Colombiana; Universidad de los Llanos, Villavicencio, Colombia     FX  - The research was supported by Instituto de Investigaciones de la Orinoquia Colombiana (Convocatoria 2004), Universidad de los Llanos, Villavicencio, Colombia. The authors are grateful to Anne-Lise Haenni for help in reviewing the manuscript and the IALL personal's.     PU  - REVISTA PESQUISA VETERINARIA BRASILEIRA     PI  - RIO JANEIRO     PA  - EMBRAPA-SAUDE ANIMAL, KM47 SEROPEDICA, 23851-970 RIO JANEIRO, BRAZIL","Acute toxicity of the glyphosate -N (phosphonomethyl) glycine-herbicide, Roundup (R), in juveniles of cachama blanca, (Piaractus brachypomus), was evaluated and the histopathological lesions were assessed. The 96 h lethal concentration 50 was 97.47mg.L-1 (P < 0.05). In the gill, necrotic and proliferative lesions were detected. In the liver, congestion, degenerative foci, hyaline droplets and lipidic vacuolization of the hepatocytes were observed. In the stomach mild hyperplasia of mucous cells was detected, which was also observed in the skin. In this latter tissue, a large increase in the thickness of the epidermis with necrotic lesions, infiltration of leukocytes and melanin pigment were observed. In the brain, degenerative foci of neuronal bodies in the telencephalon associated with gliosis and infiltration of eosinophilic granule cells/mast cells were shown. In conclusion, gills, liver, skin and brain are susceptible to Roundup (R). Moreover, effects on the central nervous system could affect olfaction as well as individual and group behavior, the reproductive performance of the fish and hence have repercussions at the population level.","Times Cited in Web of Science Core Collection:  29     Total Times Cited:  36     Cited Reference Count:  42 | RAYYAN-INCLUSION: {""Shiho""=>""Excluded"", ""Kyle ""=>""Maybe""} | RAYYAN-LABELS: not sure on life stage",10.1590/S0100-736X2008001100002     WE  - Science Citation Index Expanded (SCI-EXPANDED),Roundup (R);glyphosate;acute toxicity;histopathology;Piaractus brachypomus;TILAPIA OREOCHROMIS-NILOTICUS;CYPRINUS-CARPIO;GLYPHOSATE;FISH;GILLS;RESPONSES;CELLS,NA,NA
rayyan-1227306740,Glyphosate induces cardiovascular toxicity in <i>Danio rerio</i>,2016,9,NA,ENVIRONMENTAL TOXICOLOGY AND PHARMACOLOGY,"[""1382-6689"", ""1872-7077     J9  - ENVIRON TOXICOL PHAR     JI  - Environ. Toxicol. Pharmacol.""]",46,,292-300,"Roy, NM and Ochs, J and Zambrzycka, E and Anderson, A",,English,,"Sacred Heart Univ, Dept Biol, 5151 Pk Ave, Fairfield, CT 06825 USA","Glyphosate is a broad spectrum herbicide used aggressively in agricultural practices as well as home garden care. Although labeled ""safe"" by the chemical industry, doses tested by industry do not mimic chronic exposures to sublethal doses that organisms in the environment are exposed to over long periods of time. Given the widespread uses of and exposure to glyphosate, studies on developmental toxicity are needed. Here we utilize the zebrafish vertebrate model system to study early effects of glyphosate on the developing heart. Treatment by embryo soaking with 50 mu g/ml glyphosate starting at gastrulation results in structural abnormalities in the atrium and ventricle, irregular heart looping, situs inversus as well as decreased heartbeats by 48 h as determined by live imaging and immunohistochemistry. Vasculature in the body was also affected as determined using fli-1 transgenic embryos. To determine if the effects noted at 48 h post fertilization are due to early stage alterations in myocardial precursors, we also investigate cardiomyocyte development with a Mef2 antibody and by mef2ca in situ hybridization and find alterations in the Mef2/mef2ca staining patterns during early cardiac patterning stages. We conclude that glyphosate is developmentally toxic to the zebrafish heart. (C) 2016 Elsevier B.V. All rights reserved.","Times Cited in Web of Science Core Collection:  56     Total Times Cited:  61     Cited Reference Count:  56 | RAYYAN-INCLUSION: {""Shiho""=>""Excluded"", ""Kyle ""=>""Maybe""} | RAYYAN-LABELS: no behaviour,maybe assess some behaviours",10.1016/j.etap.2016.08.010     WE  - Science Citation Index Expanded (SCI-EXPANDED),Zebrafish;Development;Glyphosate;Cardiac;Vasculature;HERBICIDE GLYPHOSATE;CARDIOMYOCYTE DIFFERENTIATION;3-PHOSPHATE SYNTHASE;MODEL VERTEBRATE;HEART FIELD;ZEBRAFISH;ROUNDUP;FORMULATIONS;PESTICIDES;EXPRESSION,NA,NA
rayyan-1227306750,From dysbiosis to neuropathologies: Toxic effects of glyphosate in zebrafish,2024,NA,NA,Ecotoxicology and Environmental Safety,01476513 (ISSN),270,,,"Bellot, M. and Carrillo, M.P. and Bedrossiantz, J. and Zheng, J. and Mandal, R. and Wishart, D.S. and Gómez-Canela, C. and Vila-Costa, M. and Prats, E. and Piña, B. and Raldúa, D.",https://www.scopus.com/inward/record.uri?eid=2-s2.0-85181020250&doi=10.1016%2fj.ecoenv.2023.115888&partnerID=40&md5=5d498944409a9a51f22af5511b860c3b,English,Academic Press,"[""Department of Analytical and Applied Chemistry, School of Engineering, Institut Químic de Sarrià-Universitat Ramon Llull, Barcelona, 08017, Spain"", ""Institute for Environmental Assessment and Water Research (IDAEA-CSIC), Barcelona, 08034, Spain"", ""Research and Development Center (CID-CSIC), Jordi Girona, 18, Barcelona, 08034, Spain"", ""Department of Biological Sciences, University of Alberta, Edmonton, AB, Canada""]","Glyphosate, a globally prevalent herbicide known for its selective inhibition of the shikimate pathway in plants, is now implicated in physiological effects on humans and animals, probably due to its impacts in their gut microbiomes which possess the shikimate pathway. In this study, we investigate the effects of environmentally relevant concentrations of glyphosate on the gut microbiota, neurotransmitter levels, and anxiety in zebrafish. Our findings demonstrate that glyphosate exposure leads to dysbiosis in the zebrafish gut, alterations in central and peripheral serotonin levels, increased dopamine levels in the brain, and notable changes in anxiety and social behavior. While the dysbiosis can be attributed to glyphosate's antimicrobial properties, the observed effects on neurotransmitter levels leading to the reported induction of oxidative stress in the brain indicate a novel and significant mode of action for glyphosate, namely the impairment of the microbiome-gut-axis. While further investigations are necessary to determine the relevance of this mechanism in humans, our findings shed light on the potential explanation for the contradictory reports on the safety of glyphosate for consumers. © 2023 The Authors","Export Date: 01 March 2024; Cited By: 0; Correspondence Address: B. Piña; IDAEA-CSIC, Barcelona, Jordi Girona, 18, 08034, Spain; email: bpcbmc@cid.csic.es; CODEN: EESAD | RAYYAN-INCLUSION: {""Shiho""=>""Maybe"", ""Kyle ""=>""Maybe""}",10.1016/j.ecoenv.2023.115888,"Herbicides;Microbiota;Neurotoxicity;Neurotransmitter;Transgenics;Animals;Dysbiosis;Glycine;Glyphosate;Humans;Neurotransmitter Agents;Shikimic Acid;Zebrafish;dopamine;glyphosate;neurotransmitter;serotonin;agents interacting with transmitter, hormone or drug receptors;glycine;herbicide;shikimic acid;concentration (composition);cyprinid;microbial community;pathology;toxicity;adult;antimicrobial activity;anxiety;Article;concentration (parameter);controlled study;dysbiosis;environmental exposure;female;gastrointestinal toxicity;intestine flora;male;microflora;neuropathology;neurotoxicity;nonhuman;oxidative stress;safety;social behavior;transgenics;zebra fish;animal;human;metabolism",NA,NA
rayyan-1227306759,"Neonicotinoid Imidacloprid Affects the Social Behavior of Adult Zebrafish by Damaging Telencephalon Neurons through Oxidation Stress, Inflammation, and Apoptosis",2023,NA,NA,Life,20751729 (ISSN),13,6,,"Chung, K.-T. and Chen, L.-W. and Tseng, H.-W. and Wu, C.-H.",https://www.scopus.com/inward/record.uri?eid=2-s2.0-85163791000&doi=10.3390%2flife13061418&partnerID=40&md5=425a4d08257426efd7c487f0730deaee,English,MDPI,"[""Department of Chemical Engineering, Army Academy of ROC, Taoyuan City, 320, Taiwan"", ""Department of Science Education and Application, National Taichung University of Education, Taichung City, 403, Taiwan"", ""School of Life Science, National Taiwan Normal University, Taipei, 106, Taiwan""]","The neonicotinoid imidacloprid is a widely used insecticide worldwide. We assessed the effects of acute and chronic imidacloprid exposure on the social behavior of adult zebrafish. We assembled simple apparatus to detect 2D locomotion: a single camera capture system and two specially designed water tanks. We then used the tracking and heat maps of the behavior trajectories of zebrafish subjected to sham and imidacloprid exposure and compared their social behavior. Furthermore, histomorphology and immunohistochemistry of their brain tissue sections were performed to clarify possible neurotoxicity due to imidacloprid exposure in our adult zebrafish. Our results showed that imidacloprid exposure significantly reduced the zebrafish’s swimming speed, distance traveled, acceleration, and deceleration. The longer the imidacloprid exposure, the more severe the locomotor behavior disability. Furthermore, imidacloprid exposure significantly reduced heterosexual attractive behavior between the different sexes, as well as defensive alert behavior among males. Our histomorphology and immunohistochemistry evidence showed imidacloprid exposure may lead to neuronal oxidative stress, inflammation, apoptosis, and damage in the telencephalon of adult zebrafish. Thus, we suggested that neonicotinoid imidacloprid exposure can damage the telencephalon neurons of adult zebrafish through oxidative stress, inflammation, and apoptosis and then affect the social behavior of adult zebrafish. © 2023 by the authors.","Export Date: 01 March 2024; Cited By: 0; Correspondence Address: C.-H. Wu; School of Life Science, National Taiwan Normal University, Taipei, 106, Taiwan; email: megawu@ntnu.edu.tw | RAYYAN-INCLUSION: {""Shiho""=>""Maybe"", ""Kyle ""=>""Included""}",10.3390/life13061418,apoptosis;imidacloprid;inflammation;oxidative stress;telencephalon;zebrafish;Oxidative Stress;Social Behavior;Inflammation,NA,NA
rayyan-1227306775,"Environmental levels of azoxystrobin disturb male zebrafish behavior: Possible roles of oxidative stress, cholinergic system, and dopaminergic system",2024,NA,NA,Ecotoxicology and Environmental Safety,01476513 (ISSN),269,,,"Guo, X. and Zhang, R. and Li, C. and Duan, M. and Cao, N. and Jin, Q. and Chen, X. and Li, L. and Li, X. and Pang, S.",https://www.scopus.com/inward/record.uri?eid=2-s2.0-85179812676&doi=10.1016%2fj.ecoenv.2023.115744&partnerID=40&md5=4c17fc8ddaa67259fd6b6135c4ad8e87,English,Academic Press,"[""Department of Applied Chemistry, College of Sciences, China Agricultural University, Beijing, 100193, China"", ""State Key Laboratory of NBC Protection for Civilian, Beijing, 102205, China"", ""Institute of Cultural Heritage and History of science & Technology, University of Science and Technology Beijing, Beijing, 100083, China""]","A widely applied pesticide of azoxystrobin, is increasingly detected in the water environment. Concern has been raised against its potential detriment to aquatic ecosystems. It has been shown that exposure to azoxystrobin interfere with the locomotor behavior of zebrafish larvae. This study aims to investigate whether exposure to environmental levels of azoxystrobin (2 μg/L, 20 μg/L, and 200 μg/L) changes the behavior of male adult zebrafish. Herein, we evaluated behavioral response (locomotor, anxiety-like, and exploratory behaviors), histopathology, biochemical indicators, and gene expression in male adult zebrafish upon azoxystrobin exposure. The study showed that exposure to azoxystrobin for 42 days remarkably increased the locomotor ability of male zebrafish, resulted in anxiety-like behavior, and inhibited exploratory behavior. After treatment with 200 μg/L azoxystrobin, vasodilatation, and congestion were observed in male zebrafish brains. Exposure to 200 μg/L azoxystrobin notably elevated ROS level, MDA concentration, CAT activity, and AChE activity, while inhibiting SOD activity, GPx activity, ACh concentration, and DA concentration in male zebrafish brains. Moreover, the expression levels of genes related to the antioxidant, cholinergic, and dopaminergic systems were significantly changed. This suggests that azoxystrobin may interfere with the homeostasis of neurotransmitters by causing oxidative stress in male zebrafish brains, thus affecting the behavioral response of male zebrafish. © 2023 The Authors","Export Date: 01 March 2024; Cited By: 0; Correspondence Address: S. Pang; Beijing, NO. 2 Yuan Ming Yuan West Road, Haidian District, 100193, China; email: pangsen7812@cau.edu.cn; CODEN: EESAD | RAYYAN-INCLUSION: {""Shiho""=>""Maybe"", ""Kyle ""=>""Maybe""} | RAYYAN-LABELS: not sure on behaviours assessed",10.1016/j.ecoenv.2023.115744,"Antioxidant system;Anxiety-like behavior;Azoxystrobin;Exploratory behavior;Neurotransmitter homeostasis;Animals;Cholinergic Agents;Ecosystem;Male;Oxidative Stress;Pyrimidines;Strobilurins;Water Pollutants, Chemical;Zebrafish;acetylcholine;acetylcholinesterase;azoxystrobin;catalase;choline;dopamine;glutathione peroxidase;malonaldehyde;reactive oxygen metabolite;strobilurin;superoxide dismutase;unclassified drug;cholinergic receptor stimulating agent;pyrimidine derivative;antioxidant;behavioral response;biochemistry;cyprinid;gene expression;histopathology;homeostasis;hormone;male;oxidative stress;adult;animal behavior;animal experiment;animal tissue;anxiety;Article;behavior change;behavior disorder;cholinergic system;controlled study;dopaminergic system;ecotoxicity;ecotoxicology;environmental exposure;enzyme activity;exploratory behavior;gene;gene expression level;locomotion;nonhuman;novel object recognition test;open field test;vasodilatation;zebra fish;animal;ecosystem;metabolism;water pollutant",NA,NA
rayyan-1227306818,"Rotenone alters behavior and reproductive functions of freshwater catfish, <i>Mystus cavasius</i>, through deficits of dopaminergic neurons in the brain",2021,1,NA,CHEMOSPHERE,"[""0045-6535"", ""1879-1298     J9  - CHEMOSPHERE     JI  - Chemosphere""]",263,,,"Badruzzaman, M and Shahjahan, M and Roy, PK and Islam, MT",,English,,"[""Bangabandhu Sheikh Mujibur Rahman Agr Univ, Dept Biochem & Mol Biol, Gazipur 1706, Bangladesh"", ""Bangladesh Agr Univ, Dept Fisheries Management, Lab Fish Ecophysiol, Mymensingh 2202, Bangladesh"", ""Okinawa Inst Sci & Technol Grad Univ, Chem & Chem Bioengn Unit, Onna, Okinawa 9040495, Japan"", ""Bangabandhu Sheikh Mujibur Rahman Agr Univ, Dept Pathobiol, Gazipur 1706, Bangladesh""]","Rotenone, commonly used as a pesticide in agriculture and as a piscicide in aquaculture, is a toxic compound that causes dopaminergic neuronal cell loss in the substantia nigra pars compacta of the brain. At the neuroendocrine level, dopamine (DA) drives behavioral (locomotion, emotion, feeding, and social interactions, etc.) and reproductive functions of fish. In the current investigation, we examined effects of rotenone toxicity on neurobehavioral and reproductive functions in whole brain and in selected brain regions in an Indian freshwater catfish, locally known as gulsha (Mystus cavasius). After fish were exposed to water containing rotenone at 0, 2.5, 25, and 250 mu g/L for 2 days, significant reductions of DA, 3,4-dihydroxyphenylacetic acid (DOPAC; a DA metabolite), and their ratio (DOPAC/DA) were observed in whole brain at 250 mg/L ambient concentrations of rotenone. When fish were treated with rotenone at 250 mg/L concentration for 2 days, there was a significant reduction of DA, DOPAC and DOPAC/DA in diencephalon, DA and DOPAC in pituitary, and only DA in the telencephalon, compared with control fish. In parallel, numbers of tyrosine hydroxylase-positive (THthorn) neurons declined significantly in the diencephalon and pituitary after rotenone treatment. Slowed, spontaneous movement and reduced feeding behavior were observed in rotenone-treated fish. Rotenone treatment resulted in a significantly higher gonadosomatic index with many mature vitellogenic oocytes in ovaries and lowered dopaminergic activity in these fish. These results indicate that rotenone influences neurobehavioral and reproductive functions through dopaminergic neuronal cell loss in gulsha brain. (C) 2020 Elsevier Ltd. All rights reserved.","Times Cited in Web of Science Core Collection:  9     Total Times Cited:  10     Cited Reference Count:  47 | RAYYAN-INCLUSION: {""Shiho""=>""Maybe"", ""Kyle ""=>""Included""}",10.1016/j.chemosphere.2020.128355     WE  - Science Citation Index Expanded (SCI-EXPANDED),Dopamine;Catfish;Locomotion;Reproduction;Hypothalamus;Pituitary;PARKINSONS-DISEASE;EUROPEAN EEL;RECEPTOR SUBTYPES;GENE-EXPRESSION;FEMALE GOLDFISH;RAINBOW-TROUT;MESSENGER-RNA;GONADOTROPIN;PITUITARY;RELEASE;Brain;Reproductive Behavior,NA,NA
rayyan-1227306836,Biochemical and behavioral effects of carbofuran in goldfish (<i>Carassius auratus</i>),2002,1,NA,ENVIRONMENTAL TOXICOLOGY AND CHEMISTRY,"[""0730-7268"", ""1552-8618     J9  - ENVIRON TOXICOL CHEM     JI  - Environ. Toxicol. Chem.""]",21,1,175-181,"Bretaud, S and Saglio, P and Saligaut, C and Auperin, B",,English,,"[""INRA, Aquat Ecol Lab, UMR EQHC, F-35042 Rennes, France"", ""INRA, SCRIBE, F-35042 Rennes, France"", ""CNRS, UMR 6026, F-35042 Rennes, France""]","The effects of concentration (5, 50, and 500 mug/L) and duration (24, 48 h) of exposure to carbofuran, a carbamate insecticide, were assessed on brain catecholamine (norepinephrine [NE] and dopamine), plasma glucose, and hepatic glycogen contents and behavioral activities of goldfish (Carassius auratus). After 24 h of exposure to 50 and 500 mug/L, the level of NE was increased in the olfactory bulbs. The same effect was observed after a 48-h exposure to 500 and 50 mug/L in the telencephalic hemispheres and in the hypothalamus, respectively. An increase in the level of dopamine was also found in hypothalamus after 48 h of exposure to 500 mug/L carbofuran. Plasma glucose increased in concentration after both periods of exposure to carbofuran at 50 and 500 mug/L. Hepatic glycogen concentration decreased after a 48-h exposure to the highest concentration, Behavioral endpoints related to swimming pattern and social interactions were affected after a 24-h exposure to the lowest concentration tested (5 mug/L). The relative sensitivities of these different types of responses to exposure to carbofuran are discussed in light of data on the neurotoxic effects of carbamate and organophosphate insecticides in fish.","Times Cited in Web of Science Core Collection:  40     Total Times Cited:  44     Cited Reference Count:  40 | RAYYAN-INCLUSION: {""Shiho""=>""Maybe"", ""Kyle ""=>""Maybe""} | RAYYAN-LABELS: not sure on behaviours assessed",10.1897/1551-5028(2002)021<0175:BABEOC>2.0.CO;2     WE  - Science Citation Index Expanded (SCI-EXPANDED),behavior;catecholamine;fish;glucose;insecticide;FRESH-WATER FISH;ONCORHYNCHUS-MYKISS BRAIN;ACETYLCHOLINESTERASE ACTIVITY;NEUROTRANSMITTER LEVELS;NEUROBEHAVIORAL CHANGES;FUNDULUS-HETEROCLITUS;SUBLETHAL TOXICITY;DOPAMINE TURNOVER;BIOGENIC-AMINES;STRESS,NA,NA
